{
  "$schema": "../schemas/alarm_power.schema.json",
  "schemaVersion": 1,
  "verified": false,
  "notes": [
    "Набор по умолчанию для расчёта АКБ приборов автоматики АУПТ (ADR 0012, этап 1): контроллер линии С2000-КДЛ, модули входов С2000-АР8 по одному входу на сигнал, РИП-12 исп.01 с АБ 1217С. Это выбор программы, не норма: при другом оборудовании проекта числа меняются здесь, по его паспортам.",
    "Все токи — при 12 В. Пульт С2000М и приборы АПС и СОУЭ (этапы 2–3) в набор не входят.",
    "АБ тип С, а не К: таблица разряда 24 ч (табл. 3.4 РЭ АБ), на которую паспорт ссылается для расчёта по прил. Б СП 6.13130.2025, дана только для типов С и М, рекомендуемых для СПЗ.",
    "Kн паспорт АБ задаёт формулами (п. 4.3 РЭ АБ): Kн = C20 / (I·t), I — ток разряда за t ч; S = 80 % (п. 4.2) даёт Kстр = 1,25 по формуле Б.2."
  ],
  "voltage": 12,
  "controller": {
    "name": "С2000-КДЛ",
    "voltage": 12,
    "idle": 0.08,
    "loaded": 0.16,
    "loadOfLoaded": 0.0635,
    "max": 0.4,
    "maxLoopLoad": 0.064,
    "maxAddresses": 127,
    "source": "РЭ АЦДР.426469.012 РЭп, изм. 10 от 13.07.2026, табл. 1.2.1, с. 6 (bolid.ru/files/373/566/s2000_kdl_rep_jule_26.pdf): 80 мА без АУ, 160 мА при 127 АУ по 0,5 мА, не более 400 мА; рекомендуемый ток АУ не более 64 мА"
  },
  "module": {
    "name": "С2000-АР8",
    "inputs": 8,
    "loopCurrent": 0.004,
    "maxPerLoop": 15,
    "source": "РЭ АЦДР.426461.003 РЭп, изм. 9 от 13.07.2026, пп. 1.2.1–1.2.3, с. 6 (bolid.ru/files/373/566/s2000_ar8_rept_v.1.60_jule_26.pdf)"
  },
  "supply": {
    "name": "РИП-12 исп.01 (РИП-12-3/17М1)",
    "voltage": 12,
    "ownCurrent": 0.04,
    "source": "РЭ АЦДР.436534.001-01 РЭп, изм. 4 от 20.06.2025, табл. 1, п. 1.2.8, с. 5 (bolid.ru/files/373/566/rip_12_01_rep_jul_25.pdf)"
  },
  "battery": {
    "name": "АБ 1217С",
    "nominal": 17,
    "endOfLifePercent": 80,
    "discharge": { "1": 10.41, "24": 0.727 },
    "source": "РЭ ТУ-27.20.22-127-73200020-2018, изм. 8 от 18.06.2026 (bolid.ru/files/373/566/ab_1207s_rep_june_2026.pdf): C20 и I1ч — табл. 3.2, с. 9; I24ч — табл. 3.4, с. 10; S — п. 4.2, с. 13"
  }
}
